Title,URL
「肥満治療薬」の社会的インパクト(The Economist),https://www.nikkei.com/article/DGXZQOCB261YF0W4A021C2000000/
北朝鮮兵拠点にウクライナ軍砲撃か　被害は不明,https://www.nikkei.com/article/DGXZQOCB043AV0U4A101C2000000/
4日の石破首相の動静,https://www.nikkei.com/article/DGXZQOUA040Y40U4A101C2000000/
法相に鈴木馨祐氏　落選の牧原秀樹氏後任に調整,https://www.nikkei.com/article/DGXZQOUA042SS0U4A101C2000000/
UNRWAとの「協力終了」　イスラエルが国連に通告,https://www.nikkei.com/article/DGXZQOCB0432T0U4A101C2000000/
首相指名選挙、5度目の決選投票へ　石破政権継続の公算,https://www.nikkei.com/article/DGXZQOUA030990T01C24A1000000/
一家の食費、月9万円突破　節約献立は2年前から様変わり,https://www.nikkei.com/article/DGXZQOUC174DQ0X11C24A0000000/
広州交易会、契約額1割増　中国最大級の貿易商談会,https://www.nikkei.com/article/DGXZQOGM042E70U4A101C2000000/
千葉・四街道の強盗　逮捕の男「高額バイト検索」と供述,https://www.nikkei.com/article/DGXZQOUE041ZO0U4A101C2000000/
DeNA三浦大輔監督　貫いた横浜愛、日本一で結実,https://www.nikkei.com/article/DGXZQODH042020U4A101C2000000/
欧州市場の主要指標11時半　欧州株、上昇　円は対ドルで一時151円台半ばへ上昇,https://www.nikkei.com/article/DGXZQOFL042HN0U4A101C2000000/
松山英樹、7位で変わらず　男子ゴルフ世界ランキング,https://www.nikkei.com/article/DGXZQOKC042S30U4A101C2000000/
社会人野球、トヨタ自動車など8強　日本選手権,https://www.nikkei.com/article/DGXZQOKC042QX0U4A101C2000000/
中国、地方債務の上限引き上げを議論　全人代常務委,https://www.nikkei.com/article/DGXZQOGM042HP0U4A101C2000000/
東証の株取引、5日から30分延長　売買確保へ慣行見直す,https://www.nikkei.com/article/DGXZQOUB30DVR0Q4A031C2000000/
PayPayのデジタル給与払い、グループ外企業も対象に,https://www.nikkei.com/article/DGXZQOUB0425R0U4A101C2000000/
インドネシア・フローレス島で火山噴火、10人死亡,https://www.nikkei.com/article/DGXZQOCB041YM0U4A101C2000000/
水害被災者、スペイン国王に泥投げる　支援遅れ不満,https://www.nikkei.com/article/DGXZQOCB042KA0U4A101C2000000/
卓球Tリーグ、金沢が4勝目　岡山に快勝,https://www.nikkei.com/article/DGXZQOKC042D70U4A101C2000000/
ロンドン外為9時半　円相場上昇、151円台後半　米金利低下とともにドル売り,https://www.nikkei.com/article/DGXZQOFL042660U4A101C2000000/
経験生かし、政局で恩返し　岸田前首相が望月氏墓参,https://www.nikkei.com/article/DGXZQOUA042380U4A101C2000000/
バレーSVリーグ、サントリーが東京GBに勝利　3勝3敗に,https://www.nikkei.com/article/DGXZQOKC0429H0U4A101C2000000/
トルコ、対パレスチナ輸出10倍　イスラエルに迂回か,https://www.nikkei.com/article/DGXZQOGR202L30Q4A021C2000000/
国内特許、海外サーバー利用でも対象に　動画サイトなど,https://www.nikkei.com/article/DGXZQOUA015XS0R01C24A1000000/
北朝鮮、爆破道路に11メートルの壁　韓国軍「見せかけ」,https://www.nikkei.com/article/DGXZQOGM041GW0U4A101C2000000/
バスケBリーグ、川崎が佐賀に勝利　3勝目,https://www.nikkei.com/article/DGXZQOKC0422Y0U4A101C2000000/
日中高官、首脳会談含む対話継続で一致　邦人安全も協議,https://www.nikkei.com/article/DGXZQOGM040730U4A101C2000000/
クインシー・ジョーンズさん死去　「スリラー」手がける,https://www.nikkei.com/article/DGXZQOUE042260U4A101C2000000/
ハリス氏、アイオワ州でリードか　地元世論調査,https://www.nikkei.com/article/DGXZQOCB041GU0U4A101C2000000/
大の里、18年ぶり新大関Vに挑む　九州場所10日初日,https://www.nikkei.com/article/DGXZQODH0163I0R01C24A1000000/
